{
  "schema": "simplicio.convergence-parity-fixture/v1",
  "fixture_id": "runtime-unavailable-issue-1140",
  "provenance": {
    "repository": "wesleysimplicio/simplicio-loop",
    "revision": "fixture-issue-1140-v1",
    "source": "tests/fixtures/convergence_parity/runtime-unavailable.json"
  },
  "task": {
    "run_id": "parity-run-1140-unsupported",
    "task_id": "issue-1140-unsupported",
    "issue": "1140",
    "title": "Record unsupported Runtime environment without fallback"
  },
  "signals": [
    {
      "schema": "simplicio.progress-signal/v1",
      "signal_id": "unsupported-progress",
      "source": "loop",
      "evidence": {"id": "unsupported-progress", "hash": "sha256:unsupported-progress"},
      "semantic": {"task_frontier": "implemented", "validation": "pending"},
      "outcome": "progress"
    },
    {
      "schema": "simplicio.progress-signal/v1",
      "signal_id": "unsupported-verified",
      "source": "loop",
      "evidence": {"id": "unsupported-verified", "hash": "sha256:unsupported-verified"},
      "semantic": {
        "task_frontier": "complete",
        "validation": "passed",
        "receipts": ["acceptance", "delivery"]
      },
      "outcome": "verified"
    }
  ],
  "loop_evidence": [
    {"acceptance_verified": false, "delivery_verified": false},
    {"acceptance_verified": true, "delivery_verified": true}
  ],
  "runtime_decision": null,
  "standalone_runtime": {
    "status": "unavailable",
    "reason_code": "runtime_binary_not_found",
    "detail": "No Runtime binary was available for this fixture",
    "effects_attempted": false
  }
}