{
  "schema": "simplicio.convergence-parity-fixture/v1",
  "fixture_id": "verified-issue-1140",
  "provenance": {
    "repository": "wesleysimplicio/simplicio-loop",
    "revision": "fixture-issue-1140-v1",
    "source": "tests/fixtures/convergence_parity/verified.json"
  },
  "task": {
    "run_id": "parity-run-1140",
    "task_id": "issue-1140",
    "issue": "1140",
    "title": "Prove Runtime-backed and standalone convergence parity"
  },
  "signals": [
    {
      "schema": "simplicio.progress-signal/v1",
      "signal_id": "parity-progress",
      "source": "loop",
      "evidence": {"id": "evidence-progress", "hash": "sha256:fixture-progress"},
      "semantic": {"task_frontier": "implemented", "validation": "pending"},
      "outcome": "progress"
    },
    {
      "schema": "simplicio.progress-signal/v1",
      "signal_id": "parity-verified",
      "source": "loop",
      "evidence": {"id": "evidence-verified", "hash": "sha256:fixture-verified"},
      "semantic": {
        "task_frontier": "complete",
        "validation": "passed",
        "receipts": ["acceptance", "delivery"]
      },
      "outcome": "verified"
    }
  ],
  "loop_evidence": [
    {"acceptance_verified": false, "delivery_verified": false},
    {"acceptance_verified": true, "delivery_verified": true}
  ],
  "runtime_decision": {
    "schema": "simplicio.loop-policy-decision/v1",
    "authority": "runtime",
    "owner": "simplicio-runtime",
    "host_may_override": false,
    "use_loop": true,
    "verdict": "recommended",
    "task_fingerprint": "fixture-task-1140"
  },
  "standalone_runtime": {
    "status": "unavailable",
    "reason_code": "runtime_unavailable",
    "detail": "fixture explicitly runs without Runtime",
    "effects_attempted": false
  }
}